### ISSUE TITLE
net stats: many received TCP packets count as "dropped"

### ISSUE THREAD

**Issue by arbrauns** [zephyrproject-rtos/zephyr#54599]
**Describe the bug**
In the network statistics (`net stats` shell command), many received TCP packets count as both "received" and "dropped" IP packets.

**To Reproduce**
1. `cd samples/net/dhcpv4_client`
2. change some options:
```diff
diff --git a/samples/net/dhcpv4_client/prj.conf b/samples/net/dhcpv4_client/prj.conf
index 1be69e9abd..06d471e703 100644
--- a/samples/net/dhcpv4_client/prj.conf
+++ b/samples/net/dhcpv4_client/prj.conf
@@ -12,8 +12,21 @@ CONFIG_INIT_STACKS=y
 CONFIG_NET_MGMT=y
 CONFIG_NET_MGMT_EVENT=y

-CONFIG_NET_LOG=y
 CONFIG_LOG=y

 CONFIG_SLIP_STATISTICS=n
 CONFIG_NET_SHELL=y
+
+CONFIG_SHELL_LOG_BACKEND=y
+
+CONFIG_USE_SEGGER_RTT=y
+CONFIG_SHELL_BACKEND_RTT=y
+
+CONFIG_NET_TCP=y
+CONFIG_SHELL_BACKEND_TELNET=y
+
+CONFIG_NET_STATISTICS=y
+CONFIG_NET_STATISTICS_USER_API=y
+CONFIG_NET_STATISTICS_PER_INTERFACE=y
+CONFIG_NET_STATISTICS_ETHERNET=y
+CONFIG_NET_STATISTICS_ETHERNET_VENDOR=y
```
3. `west build --board=stm32f769i_disco`
4. connect to RTT shell (or UART, just not telnet)
5. observe these stats after `net stats reset`:
```
Interface 0x20020b18 (Ethernet) [1]
===================================
IPv4 recv      0	sent	0	drop	0	forwarded	0
IP vhlerr      0	hblener	0	lblener	0
IP fragerr     0	chkerr	0	protoer	0
ICMP recv      0	sent	0	drop	0
ICMP typeer    0	chkerr	0
UDP recv       0	sent	0	drop	0
UDP chkerr     0
TCP bytes recv 0	sent	0	resent	0
TCP seg recv   0	sent	0	drop	0
TCP seg resent 0	chkerr	0	ackerr	0
TCP seg rsterr 0	rst	0
TCP conn drop  0	connrst	0
TCP pkt drop   0
Bytes received 0
Bytes sent     0
Processing err 0
```
6. open and close a TCP connection to the telnet port using e.g. `nc 192.168.10.150 23`
7. observe the following packets on the wire:
```
10:46:55.849653 IP 192.168.10.42.34754 > 192.168.10.150.23: Flags [S], seq 2442537185, win 64240, options [mss 1460,sackOK,TS val 659560615 ecr 0,nop,wscale 7], length 0
10:46:55.849898 IP 192.168.10.150.23 > 192.168.10.42.34754: Flags [S.], seq 1157883821, ack 2442537186, win 1536, options [mss 1460], length 0
10:46:55.849947 IP 192.168.10.42.34754 > 192.168.10.150.23: Flags [.], ack 1, win 64240, length 0
10:46:56.451774 IP 192.168.10.42.34754 > 192.168.10.150.23: Flags [F.], seq 1, ack 1, win 64240, length 0
10:46:56.451964 IP 192.168.10.150.23 > 192.168.10.42.34754: Flags [F.], seq 1, ack 2, win 1536, length 0
10:46:56.452014 IP 192.168.10.42.34754 > 192.168.10.150.23: Flags [.], ack 2, win 64239, length 0
```
8. observe these `net stats`:
```
Interface 0x20020b18 (Ethernet) [1]
===================================
IPv4 recv      4	sent	2	drop	4	forwarded	0
IP vhlerr      0	hblener	0	lblener	0
IP fragerr     0	chkerr	0	protoer	0
ICMP recv      0	sent	0	drop	0
ICMP typeer    0	chkerr	0
UDP recv       0	sent	0	drop	0
UDP chkerr     0
TCP bytes recv 0	sent	0	resent	0
TCP seg recv   0	sent	0	drop	0
TCP seg resent 0	chkerr	0	ackerr	0
TCP seg rsterr 0	rst	0
TCP conn drop  0	connrst	0
TCP pkt drop   4
Bytes received 254
Bytes sent     112
Processing err 0
```

**Expected behavior**
4 IPv4 packets are received, 2 are sent, none are dropped.

**Impact**
This makes it harder to analyze network problems, because many legitimate packages are counted as "dropped".

**Logs and console output**
N/A

**Environment (please complete the following information):**
 - OS: Linux
 - Toolchain: Zephyr SDK
 - Commit SHA or Version used: v3.2.0, v3.3.0-rc2

**Comment by rlubos** [comment]
@arbrauns Please give https://github.com/zephyrproject-rtos/zephyr/pull/54711 a try.
