### ISSUE TITLE
TCP reset the incoming SYN with wrong acknum

### ISSUE THREAD

**Issue by shrek-wang** [zephyrproject-rtos/zephyr#90086]
**Describe the bug**

When starting a new TCP connection from Linux to Zephyr, if Zephyr is not 
listening to that 'dport', Linux should received a RST and immediately failed
with 'Connection refused'. But in fact, Linux waited for >1 minute and failed
with 'Connection time out'.
After using 'tcpdump' to analyze the traffics, it turned out to be wrong ack-
num in the RST generated by Zephyr and Linux dropped it. After max-times
retransmission, Linux failed with timeout.
 

**To Reproduce**

1. Open Terminal1, 'cd ~/zephyrproject/tools/net-tools/' and execute './net-setup.sh'.
2. Open Terminal2, build and run Zephyr 'echo_service' sample:
    (1) west build -p always -b qemu_x86 samples/net/sockets/echo_service -- -DEXTRA_CONF_FILE=overlay-e1000.conf
    (2) west build -t run
3. Open Terminal3, run 'sudo tcpdump -i zeth'
4. Open Terminal4, run 'telnet 192.0.2.1 4554'
5. See error on Terminal4 after >1 minute:
    telnet: Unable to connect to remote host: Connection timed out
6. Check Terminal3 for details, many SYN packets and RST packets appeared like this:
11:49:14.537611 IP 192.0.2.2.35946 > 192.0.2.1.4554: Flags [S], seq 1123117624, win 64240, options [mss 1460,sackOK,TS val 475460034 ecr 0,nop,wscale 7], length 0
11:49:14.541464 IP 192.0.2.1.4554 > 192.0.2.2.35946: Flags [R.], seq 0, ack 1123117624, win 0, length 0
11:49:14.544757 IP 192.0.2.2.35946 > 192.0.2.1.4554: Flags [S], seq 1123117624, win 64240, options [mss 1460,sackOK,TS val 475460044 ecr 0,nop,wscale 7], length 0
11:49:14.545283 IP 192.0.2.1.4554 > 192.0.2.2.35946: Flags [R.], seq 0, ack 1, win 0, length 0
11:49:15.583767 IP 192.0.2.2.35946 > 192.0.2.1.4554: Flags [S], seq 1123117624, win 64240, options [mss 1460,sackOK,TS val 475461083 ecr 0,nop,wscale 7], length 0
11:49:15.585021 IP 192.0.2.1.4554 > 192.0.2.2.35946: Flags [R.], seq 0, ack 1, win 0, length 0

7. On Terminal2 (Zephyr console), run 'net tcp connect 192.0.2.2 4554' and check Terminal3 (tcpdump):
12:30:52.259578 IP 192.0.2.1.42277 > 192.0.2.2.4554: Flags [S], seq 1494700184, win 2730, options [mss 1460], length 0
12:30:52.259588 IP 192.0.2.2.4554 > 192.0.2.1.42277: Flags [R.], seq 0, ack 1494700185, win 0, length 0

8. Check the difference of RST packets - the acknum.

**Expected behavior**

The expected failure on Terminal4 is:
telnet: Unable to connect to remote host: Connection refused

**Impact**

**Logs and console output**

**Environment (please complete the following information):**

 - OS: (e.g. Linux, MacOS, Windows)
 - Toolchain (e.g Zephyr SDK, ...)
 - Commit SHA or Version used

**Additional context**
